{
  "apiVersion": "northgate/v1alpha1",
  "kind": "BootstrapMediaRequest",
  "assetId": "NG-VM-021",
  "name": "NG-KALI-EXT01",
  "hostname": "ng-kali-ext01",
  "family": "kali",
  "imageId": "kali-2026.2-installer-netinst-amd64",
  "architecture": "x86_64",
  "staticMacAddress": "024E47000015",
  "vlanId": 250,
  "network": {
    "address": "172.31.250.10",
    "prefixLength": 24,
    "gateway": "172.31.250.1",
    "dnsServers": ["172.31.250.1"],
    "domainSuffix": "redteam.test"
  },
  "roleHook": "kali-external-lab",
  "managementSourceAddress": "10.10.100.11",
  "bootstrapIdentity": "northgate-bootstrap",
  "temporaryAccessHours": 24,
  "firmwareProfile": "kali-gen2-unsigned",
  "secureBoot": false,
  "secureBootTemplate": "Disabled",
  "secureBootExceptionId": "NG-FW-20260802-KALI-UNSIGNED",
  "vtpmRequired": false,
  "buildEpochUtc": "2026-08-02T00:00:00Z"
}
