{
  "apiVersion": "northgate/v1alpha1",
  "kind": "BootstrapMediaRequest",
  "assetId": "NG-VM-018",
  "name": "NG-DEB-CAN01",
  "hostname": "ng-deb-can01",
  "family": "debian",
  "imageId": "debian-12.12-amd64-netinst",
  "architecture": "x86_64",
  "staticMacAddress": "024E47000012",
  "vlanId": 150,
  "network": {
    "address": "10.10.150.200",
    "prefixLength": 24,
    "gateway": "10.10.150.1",
    "dnsServers": ["10.10.150.1"],
    "domainSuffix": "northgate.test"
  },
  "roleHook": "debian12-disposable-canary",
  "managementSourceAddress": "10.10.100.11",
  "bootstrapIdentity": "northgate-bootstrap",
  "temporaryAccessHours": 24,
  "firmwareProfile": "linux-gen2",
  "secureBoot": true,
  "secureBootTemplate": "MicrosoftUEFICertificateAuthority",
  "vtpmRequired": false,
  "buildEpochUtc": "2026-08-02T00:00:00Z"
}
